Category,Job_Title,Job_Description,JD_Number,Cleaned_JD
HR,Human Resources Manager,"Job Title: Human Resources Manager. Description: Talent Acquisition Managers oversee the recruitment and hiring process. They develop recruitment strategies, source candidates, conduct interviews, and collaborate with hiring managers to attract and hire qualified talent to meet the organizations staffing needs. Skills: Talent sourcing Interviewing Onboarding Recruitment strategies HR software Responsibilities: Lead talent acquisition efforts, including sourcing, interviewing, and onboarding new employees. Collaborate with hiring managers to define job requirements. Develop and implement recruitment strategies.",1,job titl human resourc manag descript talent acquisit manag overse recruit hire process develop recruit strategi sourc candid conduct interview collabor hire manag attract hire qualifi talent meet organ staf need skill talent sourc interview onboard recruit strategi hr softwar respons lead talent acquisit effort includ sourc interview onboard new employe collabor hire manag defin job requir develop implement recruit strategi
HR,HR Coordinator,"Job Title: HR Coordinator. Description: Training Coordinators design and implement employee training programs. They assess training needs, develop training materials, and facilitate training sessions to enhance employees skills and knowledge. Skills: Training program coordination Training material development Learning management systems Responsibilities: Coordinate employee training programs, track training records, and assist with training logistics. Identify training needs and develop training materials. Facilitate training sessions or workshops.",2,job titl hr coordin descript train coordin design implement employe train program assess train need develop train materi facilit train session enhanc employe skill knowledg skill train program coordin train materi develop learn manag system respons coordin employe train program track train record assist train logist identifi train need develop train materi facilit train session workshop
HR,HR Coordinator,"Job Title: HR Coordinator. Description: Recruitment Coordinators support the hiring process by scheduling interviews, screening candidates, and assisting with onboarding. They ensure a smooth recruitment process and maintain candidate records. Skills: Recruitment process Candidate screening Applicant tracking systems Communication Responsibilities: Assist with recruitment activities, including posting job openings, coordinating interviews, and managing applicant data. Ensure a positive candidate experience. Maintain recruitment records and metrics.",3,job titl hr coordin descript recruit coordin support hire process schedul interview screen candid assist onboard ensur smooth recruit process maintain candid record skill recruit process candid screen applic track system communic respons assist recruit activ includ post job open coordin interview manag applic data ensur posit candid experi maintain recruit record metric
HR,HR Coordinator,"Job Title: HR Coordinator. Description: Benefits Coordinators administer employee benefit programs, including health insurance, retirement plans, and other perks. They assist employees with benefit inquiries and ensure compliance with benefit policies. Skills: Employee benefits administration Benefits compliance HRIS Benefits communication Responsibilities: Administer employee benefits programs, respond to benefits inquiries, and process benefit changes. Collaborate with benefits providers and brokers. Educate employees on available benefits.",4,job titl hr coordin descript benefit coordin administ employe benefit program includ health insur retir plan perk assist employe benefit inquiri ensur complianc benefit polici skill employe benefit administr benefit complianc hris benefit communic respons administ employe benefit program respond benefit inquiri process benefit chang collabor benefit provid broker educ employe avail benefit
HR,HR Manager,"Job Title: HR Manager. Description: A Human Resources Director leads HR functions, including talent acquisition, employee development, and HR strategy, to promote a positive work environment and support organizational goals. Skills: Strategic HR planning Employee relations Talent management HR policy development Leadership skills Responsibilities: Oversee all HR functions, including recruitment, benefits administration, employee relations, and policy development. Align HR strategies with business goals. Provide leadership to the HR team.",5,job titl hr manag descript human resourc director lead hr function includ talent acquisit employe develop hr strategi promot posit work environ support organiz goal skill strateg hr plan employe relat talent manag hr polici develop leadership skill respons overse hr function includ recruit benefit administr employe relat polici develop align hr strategi busi goal provid leadership hr team
HR,Human Resources Manager,"Job Title: Human Resources Manager. Description: Employee Relations Specialists focus on maintaining positive relationships between employees and the organization. They address workplace issues, conduct investigations, mediate conflicts, and promote a healthy and productive work environment. Skills: Employee conflict resolution HR compliance Employee engagement Communication skills Responsibilities: Address employee concerns, resolve conflicts, and implement HR policies and programs to foster a positive work environment. Conduct investigations and recommend corrective actions. Promote employee engagement and satisfaction.",6,job titl human resourc manag descript employe relat specialist focus maintain posit relationship employe organ address workplac issu conduct investig mediat conflict promot healthi product work environ skill employe conflict resolut hr complianc employe engag communic skill respons address employe concern resolv conflict implement hr polici program foster posit work environ conduct investig recommend correct action promot employe engag satisfact
HR,HR Manager,"Job Title: HR Manager. Description: An HR Compliance Specialist ensures adherence to employment laws and regulations, conducts audits, and provides guidance to maintain legal compliance within the organization. Skills: Employment law knowledge Compliance management Auditing skills Employee relations Communication skills Responsibilities: Ensure HR policies and practices comply with legal and regulatory requirements. Conduct audits and investigations. Provide guidance on compliance issues.",7,job titl hr manag descript hr complianc specialist ensur adher employ law regul conduct audit provid guidanc maintain legal complianc within organ skill employ law knowledg complianc manag audit skill employe relat communic skill respons ensur hr polici practic compli legal regulatori requir conduct audit investig provid guidanc complianc issu
HR,Human Resources Manager,"Job Title: Human Resources Manager. Description: HR Generalists handle various HR functions, including recruitment, employee relations, benefits administration, and HR compliance. They serve as a resource for employees and management, ensuring HR policies and practices align with organizational goals and legal requirements. Skills: HR policies and procedures Employee relations Recruitment Communication skills Responsibilities: Oversee various HR functions, including recruitment, benefits administration, and employee relations. Develop and implement HR policies and procedures. Handle employee inquiries and concerns.",8,job titl human resourc manag descript hr generalist handl various hr function includ recruit employe relat benefit administr hr complianc serv resourc employe manag ensur hr polici practic align organiz goal legal requir skill hr polici procedur employe relat recruit communic skill respons overse various hr function includ recruit benefit administr employe relat develop implement hr polici procedur handl employe inquiri concern
HR,HR Manager,"Job Title: HR Manager. Description: An Employee Development Manager focuses on employee growth and skill development, designing and implementing training programs to enhance employee capabilities and performance. Skills: Training and development Performance management Learning programs Employee engagement Coaching and mentoring Responsibilities: Focus on employee training, development, and career advancement. Create training programs and succession plans. Foster a culture of continuous learning.",9,job titl hr manag descript employe develop manag focus employe growth skill develop design implement train program enhanc employe capabl perform skill train develop perform manag learn program employe engag coach mentor respons focus employe train develop career advanc creat train program success plan foster cultur continu learn
INFORMATION-TECHNOLOGY,Network Engineer,"Job Title: Network Engineer. Description: Wireless Network Engineers design, implement, and maintain wireless network solutions. They optimize wireless connectivity, troubleshoot issues, and ensure reliable and secure wireless communications. Skills: Wireless network design and architecture Wi-Fi standards and protocols RF (Radio Frequency) planning and optimization Wireless security protocols Troubleshooting wireless network issues Responsibilities: Design, configure, and optimize wireless networks, ensuring reliable and secure wireless connectivity. Troubleshoot wireless network issues. Plan and implement wireless network upgrades.",1,job titl network engin descript wireless network engin design implement maintain wireless network solut optim wireless connect troubleshoot issu ensur reliabl secur wireless communic skill wireless network design architectur wi fi standard protocol rf radio frequenc plan optim wireless secur protocol troubleshoot wireless network issu respons design configur optim wireless network ensur reliabl secur wireless connect troubleshoot wireless network issu plan implement wireless network upgrad
INFORMATION-TECHNOLOGY,Network Administrator,"Job Title: Network Administrator. Description: Protect an organizations computer networks and systems from security threats, monitor network traffic, and respond to incidents. Skills: Network security protocols Intrusion detection and prevention Security incident response Firewall administration Vulnerability assessment Security policies and procedures Log analysis Ethical hacking Problem-solving Communication skills Attention to detail Responsibilities: Manage and secure computer networks, including firewalls and intrusion detection systems. Monitor network traffic for security threats. Implement security policies and procedures.",2,job titl network administr descript protect organ comput network system secur threat monitor network traffic respond incid skill network secur protocol intrus detect prevent secur incid respons firewal administr vulner assess secur polici procedur log analysi ethic hack problem solv communic skill attent detail respons manag secur comput network includ firewal intrus detect system monitor network traffic secur threat implement secur polici procedur
INFORMATION-TECHNOLOGY,Software Engineer,"Job Title: Software Engineer. Description: A Backend Developer is tasked with building and maintaining the server-side logic and database infrastructure of web applications. They work on the core functionality, data storage, and server communication to ensure the application runs smoothly and efficiently. Skills: Proficiency in one or more backend programming languages (e.g., Java, Python, Node.js, Ruby) API development Database management (SQL or NoSQL) Server management and deployment Security best practices Knowledge of web frameworks (e.g., Express, Django) Responsibilities: Develop server-side logic and databases using programming languages like Java, Python, or Node.js. Ensure data security and integrity. Implement APIs for seamless communication between frontend and backend.",3,job titl softwar engin descript backend develop task build maintain server side logic databas infrastructur web applic work core function data storag server communic ensur applic run smooth effici skill profici one backend program languag java python node j rubi api develop databas manag sql nosql server manag deploy secur best practic knowledg web framework express django respons develop server side logic databas use program languag like java python node j ensur data secur integr implement api seamless communic frontend backend
INFORMATION-TECHNOLOGY,Systems Administrator,"Job Title: Systems Administrator. Description: IT Support Specialists provide technical assistance to end-users, troubleshooting hardware and software problems, setting up equipment, and maintaining IT infrastructure. Skills: Technical troubleshooting Hardware and software support Customer service Problem-solving Communication Responsibilities: Provide technical support to end-users, troubleshoot hardware and software issues, and resolve IT-related problems. Install and configure computer systems and software. Maintain IT documentation and knowledge base.",4,job titl system administr descript support specialist provid technic assist end user troubleshoot hardwar softwar problem set equip maintain infrastructur skill technic troubleshoot hardwar softwar support custom servic problem solv communic respons provid technic support end user troubleshoot hardwar softwar issu resolv relat problem instal configur comput system softwar maintain document knowledg base
INFORMATION-TECHNOLOGY,IT Support Specialist,"Job Title: IT Support Specialist. Description: Desktop Support Technicians troubleshoot and maintain desktop computer systems, resolving hardware and software problems for users. Skills: Desktop hardware and software troubleshooting Operating system expertise (e.g., Windows, macOS) Remote desktop support Hardware and software upgrades Customer service skills Responsibilities: Install, configure, and maintain desktop computers and peripherals. Perform hardware and software upgrades and repairs. Manage IT inventory and asset tracking.",5,job titl support specialist descript desktop support technician troubleshoot maintain desktop comput system resolv hardwar softwar problem user skill desktop hardwar softwar troubleshoot oper system expertis window maco remot desktop support hardwar softwar upgrad custom servic skill respons instal configur maintain desktop comput peripher perform hardwar softwar upgrad repair manag inventori asset track
INFORMATION-TECHNOLOGY,Software Developer,"Job Title: Software Developer. Description: Mobile App Developers design and develop mobile applications for various platforms. They collaborate with cross-functional teams to create user-friendly and functional mobile apps that meet user needs. Skills: Mobile app development languages (e.g., Java, Swift, Kotlin) Cross-platform development (e.g., React Native, Flutter) Mobile app design principles APIs and web services integration Debugging and troubleshooting Responsibilities: Create mobile applications for iOS and Android platforms. Optimize mobile app performance and user experience. Collaborate with cross-functional teams to define app requirements.",6,job titl softwar develop descript mobil app develop design develop mobil applic various platform collabor cross function team creat user friend function mobil app meet user need skill mobil app develop languag java swift kotlin cross platform develop react nativ flutter mobil app design principl api web servic integr debug troubleshoot respons creat mobil applic io android platform optim mobil app perform user experi collabor cross function team defin app requir
INFORMATION-TECHNOLOGY,Systems Engineer,"Job Title: Systems Engineer. Description: The role of a Systems Integration Specialist involves integrating various software and hardware components to create cohesive systems. You will design and implement solutions that enable different systems to communicate and work together seamlessly. Your responsibilities also include troubleshooting integration issues, ensuring data consistency, and collaborating with cross-functional teams. Skills: Systems integration Integration architecture Data mapping Middleware technologies API integration System testing Troubleshooting Responsibilities: Integrate various software and hardware systems within an organization, ensuring seamless data flow and interoperability. Collaborate with software developers and IT teams on integration projects.",7,job titl system engin descript role system integr specialist involv integr various softwar hardwar compon creat cohes system design implement solut enabl differ system communic work togeth seamless respons also includ troubleshoot integr issu ensur data consist collabor cross function team skill system integr integr architectur data map middlewar technolog api integr system test troubleshoot respons integr various softwar hardwar system within organ ensur seamless data flow interoper collabor softwar develop team integr project
INFORMATION-TECHNOLOGY,Network Engineer,"Job Title: Network Engineer. Description: Network Security Engineers focus on protecting network systems from cyber threats. They implement security measures, monitor network traffic, and respond to security incidents to safeguard the organizations data. Skills: Network security protocols and technologies Firewalls and intrusion detection systems Vulnerability assessment and penetration testing Security policy development and enforcement Incident response and recovery Responsibilities: Focus on network security, implement security measures, and protect against cyber threats. Conduct security audits and vulnerability assessments. Respond to security incidents and breaches.",8,job titl network engin descript network secur engin focus protect network system cyber threat implement secur measur monitor network traffic respond secur incid safeguard organ data skill network secur protocol technolog firewal intrus detect system vulner assess penetr test secur polici develop enforc incid respons recoveri respons focus network secur implement secur measur protect cyber threat conduct secur audit vulner assess respond secur incid breach
INFORMATION-TECHNOLOGY,Network Administrator,"Job Title: Network Administrator. Description: Manage and maintain an organizations IT infrastructure, including servers, hardware, and software systems. Skills: System administration Server maintenance Active Directory Backup and recovery Cloud computing (e.g., AWS, Azure) Troubleshooting IT security best practices Collaboration Problem-solving Attention to detail Communication skills Technical knowledge Responsibilities: Administer servers and systems, ensuring uptime and reliability. Perform software installations and updates. Provide technical support to end-users.",9,job titl network administr descript manag maintain organ infrastructur includ server hardwar softwar system skill system administr server mainten activ directori backup recoveri cloud comput aw azur troubleshoot secur best practic collabor problem solv attent detail communic skill technic knowledg respons administ server system ensur uptim reliabl perform softwar instal updat provid technic support end user
INFORMATION-TECHNOLOGY,IT Manager,"Job Title: IT Manager. Description: An Infrastructure Manager is responsible for the operation and maintenance of an organizations IT infrastructure, including servers, networks, and data centers. Skills: Network administration System administration Virtualization technologies (e.g., VMware, Hyper-V) Storage management IT security Disaster recovery planning Capacity planning Monitoring and troubleshooting Cloud infrastructure (e.g., AWS, Azure) Vendor management Responsibilities: Manage IT infrastructure, including servers, networks, and data centers. Ensure high availability, security, and scalability of IT systems. Plan and implement technology upgrades.",10,job titl manag descript infrastructur manag respons oper mainten organ infrastructur includ server network data center skill network administr system administr virtual technolog vmware hyper storag manag secur disast recoveri plan capac plan monitor troubleshoot cloud infrastructur aw azur vendor manag respons manag infrastructur includ server network data center ensur high avail secur scalabl system plan implement technolog upgrad
DESIGNER,UX/UI Designer,"Job Title: UX/UI Designer. Description: User Interface Designers focus on the visual and interactive aspects of digital interfaces. They design layouts, buttons, and other elements to ensure a cohesive and visually appealing user interface. Skills: UI design principles and best practices Graphic design tools (e.g., Adobe Photoshop, Illustrator) Typography and color theory Visual design and layout Responsive design Responsibilities: Create visually appealing user interfaces (UI) that align with brand aesthetics and enhance user engagement. Design interface elements and interactive components. Ensure UI consistency across digital platforms.",1,job titl ux ui design descript user interfac design focus visual interact aspect digit interfac design layout button element ensur cohes visual appeal user interfac skill ui design principl best practic graphic design tool adob photoshop illustr typographi color theori visual design layout respons design respons creat visual appeal user interfac ui align brand aesthet enhanc user engag design interfac element interact compon ensur ui consist across digit platform
DESIGNER,UX/UI Designer,"Job Title: UX/UI Designer. Description: Interaction Designers specialize in designing user interactions within digital interfaces. They create meaningful and engaging user experiences by considering user behaviors and system responses. Skills: Interaction design principles User behavior and psychology Wireframing and prototyping tools Animation and micro-interaction design Collaborative design processes Responsibilities: Work on interaction design, defining how users interact with digital products and ensuring a seamless user journey. Create wireframes and prototypes to illustrate interactions. Collaborate with developers to implement interaction designs.",2,job titl ux ui design descript interact design special design user interact within digit interfac creat meaning engag user experi consid user behavior system respons skill interact design principl user behavior psycholog wirefram prototyp tool anim micro interact design collabor design process respons work interact design defin user interact digit product ensur seamless user journey creat wirefram prototyp illustr interact collabor develop implement interact design
DESIGNER,Web Designer,"Job Title: Web Designer. Description: Frontend Web Designers create the visual elements and user interfaces of websites. They use HTML, CSS, and JavaScript to design responsive, user-friendly web pages, ensuring a seamless and visually appealing online experience. Skills: Frontend web development HTML/CSS Responsive design User interface (UI) design Adobe Creative Suite Collaboration skills Responsibilities: Create visually appealing and responsive web designs using HTML, CSS, and JavaScript. Ensure cross-browser compatibility. Optimize web performance and page load times.",3,job titl web design descript frontend web design creat visual element user interfac websit use html cs javascript design respons user friend web page ensur seamless visual appeal onlin experi skill frontend web develop html cs respons design user interfac ui design adob creativ suit collabor skill respons creat visual appeal respons web design use html cs javascript ensur cross browser compat optim web perform page load time
DESIGNER,UX/UI Designer,"Job Title: UX/UI Designer. Description: User Experience Designers create intuitive and user-friendly digital interfaces. They conduct user research, design prototypes, and work to enhance the overall user experience of websites and applications. Skills: User-centered design principles UX/UI design tools (e.g., Sketch, Adobe XD) Wireframing and prototyping Usability testing and user research Information architecture and user flows Responsibilities: Design and improve user experiences (UX) by creating intuitive and user-friendly interfaces for websites and applications. Conduct user research and usability testing. Collaborate with stakeholders to gather and incorporate feedback.",4,job titl ux ui design descript user experi design creat intuit user friend digit interfac conduct user research design prototyp work enhanc overal user experi websit applic skill user center design principl ux ui design tool sketch adob xd wirefram prototyp usabl test user research inform architectur user flow respons design improv user experi ux creat intuit user friend interfac websit applic conduct user research usabl test collabor stakehold gather incorpor feedback
