Category,Job_Title,Job_Description,JD_Number,Cleaned_JD
BANKING,Investment Banker,"Job Title: Investment Banker. Description: A Mergers and Acquisitions Advisor assists in evaluating potential mergers and acquisitions, conducting due diligence, and providing strategic recommendations for corporate transactions. Skills: Mergers and acquisitions (M&A) expertise Due diligence Valuation techniques Responsibilities: Advise on mergers, acquisitions, and corporate finance transactions. Perform due diligence and financial analysis. Negotiate and structure deals.",3,job titl invest banker descript merger acquisit advisor assist evalu potenti merger acquisit conduct due dilig provid strateg recommend corpor transact skill merger acquisit expertis due dilig valuat techniqu respons advis merger acquisit corpor financ transact perform due dilig financi analysi negoti structur deal
HEALTHCARE,Registered Nurse,"Job Title: Registered Nurse. Description: A Staff Nurse provides patient care, administers medications, and collaborates with healthcare teams to ensure the well-being of patients in clinical settings. Skills: Nursing care Patient assessment Medical knowledge Responsibilities: Provide direct patient care, including assessments, medication administration, and wound care. Monitor patient conditions and vital signs. Collaborate with healthcare teams to develop care plans.",1,job titl regist nurs descript staff nurs provid patient care administ medic collabor healthcar team ensur well patient clinic set skill nurs care patient assess medic knowledg respons provid direct patient care includ assess medic administr wound care monitor patient condit vital sign collabor healthcar team develop care plan
HEALTHCARE,Registered Nurse,"Job Title: Registered Nurse. Description: A Clinical Nurse Specialist is an advanced practice nurse who specializes in specific patient populations or clinical areas, providing expert care and contributing to improved patient outcomes. Skills: Clinical nursing specialization (e.g., critical care, oncology) Advanced nursing skills Patient education Responsibilities: Specialize in a specific area of patient care, such as pediatrics or oncology. Provide expert clinical guidance and education to healthcare staff. Contribute to evidence-based practice and quality improvement.",2,job titl regist nurs descript clinic nurs specialist advanc practic nurs special specif patient popul clinic area provid expert care contribut improv patient outcom skill clinic nurs special critic care oncolog advanc nurs skill patient educ respons special specif area patient care pediatr oncolog provid expert clinic guidanc educ healthcar staff contribut evid base practic qualiti improv
HEALTHCARE,Registered Nurse,"Job Title: Registered Nurse. Description: A Charge Nurse leads and supervises nursing staff, coordinates patient care, and ensures efficient operations within a healthcare unit or department. Skills: Nursing leadership Charge nurse responsibilities Team coordination Responsibilities: Supervise nursing staff and allocate patient assignments. Ensure compliance with nursing standards and protocols. Act as a resource for nursing-related issues.",3,job titl regist nurs descript charg nurs lead supervis nurs staff coordin patient care ensur effici oper within healthcar unit depart skill nurs leadership charg nurs respons team coordin respons supervis nurs staff alloc patient assign ensur complianc nurs standard protocol act resourc nurs relat issu
ENGINEERING,Mechanical Engineer,"Job Title: Mechanical Engineer. Description: Mechanical Design Engineers create and develop mechanical systems and components, from concept to manufacturing, ensuring functionality and safety. Skills: Mechanical engineering CAD software (e.g., SolidWorks, AutoCAD) Finite element analysis Product development Prototyping Responsibilities: Design mechanical systems, components, and products. Create 3D models and detailed engineering drawings. Perform structural and thermal analyses.",1,job titl mechan engin descript mechan design engin creat develop mechan system compon concept manufactur ensur function safeti skill mechan engin cad softwar solidwork autocad finit element analysi product develop prototyp respons design mechan system compon product creat model detail engin draw perform structur thermal analysi
ENGINEERING,Civil Engineer,"Job Title: Civil Engineer. Description: A Structural Engineer designs and analyzes the structural integrity of buildings, bridges, and other structures. They ensure safety and compliance with engineering standards. Skills: Structural engineering principles Structural analysis and design software (e.g., AutoCAD, SAP2000) Building codes and standards Project management Structural integrity assessment Responsibilities: Design and analyze structural components and systems for buildings and infrastructure projects. Ensure structural safety and compliance with codes and standards. Collaborate with architects and contractors.",2,job titl civil engin descript structur engin design analyz structur integr build bridg structur ensur safeti complianc engin standard skill structur engin principl structur analysi design softwar autocad sap build code standard project manag structur integr assess respons design analyz structur compon system build infrastructur project ensur structur safeti complianc code standard collabor architect contractor
ENGINEERING,Electrical Engineer,"Job Title: Electrical Engineer. Description: Electronics Hardware Engineers develop and design electronic components and systems, from circuit boards to hardware prototypes, ensuring functionality and performance. Skills: Electronics design PCB layout Embedded systems Circuit analysis Troubleshooting Responsibilities: Develop electronic hardware components and circuits for various applications. Conduct testing and validation of electronic systems. Collaborate with cross-functional teams on product development.",3,job titl electr engin descript electron hardwar engin develop design electron compon system circuit board hardwar prototyp ensur function perform skill electron design pcb layout embed system circuit analysi troubleshoot respons develop electron hardwar compon circuit various applic conduct test valid electron system collabor cross function team product develop
ENGINEERING,Structural Engineer,"Job Title: Structural Engineer. Description: A Design Engineer creates and develops product designs and specifications, using engineering principles and design software to bring innovative products to market. Skills: Engineering design CAD software proficiency Problem-solving Technical knowledge Communication skills Responsibilities: Design structural systems and components for buildings and infrastructure projects. Perform structural analysis and calculations. Create detailed design plans and specifications.",4,job titl structur engin descript design engin creat develop product design specif use engin principl design softwar bring innov product market skill engin design cad softwar profici problem solv technic knowledg communic skill respons design structur system compon build infrastructur project perform structur analysi calcul creat detail design plan specif
ENGINEERING,Electrical Engineer,"Job Title: Electrical Engineer. Description: Power Systems Engineers design and maintain electrical power systems. They work on generation, transmission, and distribution of electrical power, focusing on safety and efficiency. Skills: Electrical engineering Power system analysis Renewable energy systems Control systems Safety regulations Responsibilities: Design and analyze electrical power systems, including transmission and distribution networks. Perform load flow analysis and ensure grid reliability. Implement energy efficiency solutions.",5,job titl electr engin descript power system engin design maintain electr power system work generat transmiss distribut electr power focus safeti effici skill electr engin power system analysi renew energi system control system safeti regul respons design analyz electr power system includ transmiss distribut network perform load flow analysi ensur grid reliabl implement energi effici solut
ENGINEERING,Process Engineer,"Job Title: Process Engineer. Description: Chemical Engineers design and oversee processes for the production of chemicals and related products. They conduct experiments, analyze data, and develop processes to optimize production, ensure safety, and minimize environmental impact. Skills: Chemical engineering Process design Chemical reactions Safety protocols Laboratory techniques Problem-solving skills Responsibilities: Specialize in chemical processes, including design and optimization. Monitor chemical reactions and processes. Ensure compliance with environmental regulations.",6,job titl process engin descript chemic engin design overse process product chemic relat product conduct experi analyz data develop process optim product ensur safeti minim environment impact skill chemic engin process design chemic reaction safeti protocol laboratori techniqu problem solv skill respons special chemic process includ design optim monitor chemic reaction process ensur complianc environment regul
ENGINEERING,Civil Engineer,"Job Title: Civil Engineer. Description: A Water Resources Engineer manages and develops water-related projects, such as dams, irrigation systems, and flood control measures, to ensure water resource sustainability. Skills: Water resources engineering Hydrology and hydraulics Environmental impact assessment Water resource modeling software Watershed management Responsibilities: Focus on water-related projects, such as flood control, water supply, and wastewater treatment. Design and manage water resource systems and infrastructure. Address water quality and conservation issues.",7,job titl civil engin descript water resourc engin manag develop water relat project dam irrig system flood control measur ensur water resourc sustain skill water resourc engin hydrolog hydraul environment impact assess water resourc model softwar watersh manag respons focus water relat project flood control water suppli wastewat treatment design manag water resourc system infrastructur address water qualiti conserv issu
ENGINEERING,Process Engineer,"Job Title: Process Engineer. Description: Industrial Engineers focus on improving efficiency and productivity in various industries. They analyze processes, design systems, and implement solutions to streamline operations, reduce costs, and enhance quality. Skills: Industrial engineering Process optimization Lean manufacturing Quality control Data analysis Workflow design Responsibilities: Focus on industrial processes and systems. Streamline operations, reduce waste, and improve productivity. Implement lean and Six Sigma methodologies.",8,job titl process engin descript industri engin focus improv effici product various industri analyz process design system implement solut streamlin oper reduc cost enhanc qualiti skill industri engin process optim lean manufactur qualiti control data analysi workflow design respons focus industri process system streamlin oper reduc wast improv product implement lean six sigma methodolog
ENGINEERING,Mechanical Engineer,"Job Title: Mechanical Engineer. Description: Manufacturing Engineers optimize manufacturing processes, improve production efficiency, and ensure product quality in manufacturing environments. Skills: Manufacturing processes knowledge CAD/CAM software proficiency Lean manufacturing principles Quality control and assurance Six Sigma certification Responsibilities: Improve manufacturing processes and production efficiency. Collaborate with production teams to implement lean manufacturing principles. Optimize manufacturing workflows and quality control.",9,job titl mechan engin descript manufactur engin optim manufactur process improv product effici ensur product qualiti manufactur environ skill manufactur process knowledg cad cam softwar profici lean manufactur principl qualiti control assur six sigma certif respons improv manufactur process product effici collabor product team implement lean manufactur principl optim manufactur workflow qualiti control
ENGINEERING,Electrical Engineer,"Job Title: Electrical Engineer. Description: Controls Engineers specialize in industrial automation, designing and implementing control systems for machinery and manufacturing processes. They optimize efficiency and safety. Skills: Control system design PLC programming Automation Instrumentation System integration Responsibilities: Design and implement control systems for industrial automation and robotics. Program PLCs (Programmable Logic Controllers) and HMI (Human-Machine Interface) systems. Troubleshoot control system issues.",10,job titl electr engin descript control engin special industri autom design implement control system machineri manufactur process optim effici safeti skill control system design plc program autom instrument system integr respons design implement control system industri autom robot program plcs programm logic control hmi human machin interfac system troubleshoot control system issu
ACCOUNTANT,Accountant,"Job Title: Accountant. Description: Financial Accountants handle financial records, prepare financial statements, and ensure compliance with accounting standards. They analyze financial data to provide accurate financial reports and support decision-making within the organization. Skills: Financial reporting Accounting software (e.g., QuickBooks) Auditing GAAP knowledge Responsibilities: Maintain financial records, prepare financial statements, and ensure compliance with accounting standards and regulations. Reconcile accounts and analyze financial data. Assist with financial audits.",1,job titl account descript financi account handl financi record prepar financi statement ensur complianc account standard analyz financi data provid accur financi report support decis make within organ skill financi report account softwar quickbook audit gaap knowledg respons maintain financi record prepar financi statement ensur complianc account standard regul reconcil account analyz financi data assist financi audit
ACCOUNTANT,Accountant,"Job Title: Accountant. Description: Tax Accountants specialize in tax-related matters. They prepare tax returns, assist with tax planning, and ensure compliance with tax laws and regulations. They stay updated on tax codes and advise organizations on tax strategies. Skills: Tax preparation Tax planning Tax regulations Accounting Tax software proficiency Responsibilities: Prepare and file tax returns, provide tax planning advice, and address tax-related issues. Stay up-to-date on tax laws and regulations. Assist clients with tax compliance and planning.",2,job titl account descript tax account special tax relat matter prepar tax return assist tax plan ensur complianc tax law regul stay updat tax code advis organ tax strategi skill tax prepar tax plan tax regul account tax softwar profici respons prepar file tax return provid tax plan advic address tax relat issu stay date tax law regul assist client tax complianc plan
ACCOUNTANT,Accountant,"Job Title: Accountant. Description: Forensic Accountants investigate financial discrepancies and fraud. They analyze financial documents, track financial transactions, and provide expert testimony in legal proceedings. They play a critical role in detecting and preventing financial fraud. Skills: Forensic accounting Fraud detection Legal knowledge Investigative skills Responsibilities: Investigate financial discrepancies, analyze financial data for fraud, and provide expert testimony in legal cases. Perform forensic audits and fraud detection. Collaborate with law enforcement and legal teams.",3,job titl account descript forens account investig financi discrep fraud analyz financi document track financi transact provid expert testimoni legal proceed play critic role detect prevent financi fraud skill forens account fraud detect legal knowledg investig skill respons investig financi discrep analyz financi data fraud provid expert testimoni legal case perform forens audit fraud detect collabor law enforc legal team
DIGITAL-MEDIA,Digital Marketing Specialist,"Job Title: Digital Marketing Specialist. Description: Social Media Managers oversee an organizations social media presence. They create and schedule content, engage with followers, and analyze social media metrics to drive brand awareness and engagement. Skills: Social media platforms (e.g., Facebook, Twitter, Instagram) Content creation and scheduling Social media analytics and insights Community engagement Paid social advertising Responsibilities: Manage and grow social media accounts, create engaging content, and interact with the online community. Develop social media content calendars and strategies. Monitor social media trends and engagement metrics.",1,job titl digit market specialist descript social medium manag overse organ social medium presenc creat schedul content engag follow analyz social medium metric drive brand awar engag skill social medium platform facebook twitter instagram content creation schedul social medium analyt insight communiti engag paid social advertis respons manag grow social medium account creat engag content interact onlin communiti develop social medium content calendar strategi monitor social medium trend engag metric
DIGITAL-MEDIA,Digital Marketing Specialist,"Job Title: Digital Marketing Specialist. Description: SEO Specialists optimize websites for search engines to improve online visibility. They conduct keyword research, optimize content, and implement SEO strategies to increase organic traffic and rankings. Skills: Search engine algorithms and ranking factors Keyword research and analysis On-page and off-page SEO optimization SEO tools (e.g., Google Analytics, SEMrush) SEO content strategy Responsibilities: Optimize websites for search engines (SEO), conduct keyword research, and improve online visibility and search rankings. Monitor and analyze SEO performance metrics. Implement SEO best practices and strategies.",2,job titl digit market specialist descript seo specialist optim websit search engin improv onlin visibl conduct keyword research optim content implement seo strategi increas organ traffic rank skill search engin algorithm rank factor keyword research analysi page page seo optim seo tool googl analyt semrush seo content strategi respons optim websit search engin seo conduct keyword research improv onlin visibl search rank monitor analyz seo perform metric implement seo best practic strategi
DIGITAL-MEDIA,Social Media Manager,"Job Title: Social Media Manager. Description: Social Media Analysts analyze social media data and metrics to provide insights and recommendations for improving social media strategies. They track performance, identify trends, and support data-driven decision-making. Skills: Social media analytics tools (e.g., Google Analytics, Facebook Insights) Data analysis and reporting Social media ROI measurement Competitive analysis Trend identification Responsibilities: Analyze social media data and user behavior to generate actionable insights. Track key performance indicators (KPIs) and recommend optimization strategies. Stay updated on social media trends and algorithm changes.",3,job titl social medium manag descript social medium analyst analyz social medium data metric provid insight recommend improv social medium strategi track perform identifi trend support data driven decis make skill social medium analyt tool googl analyt facebook insight data analysi report social medium roi measur competit analysi trend identif respons analyz social medium data user behavior generat action insight track key perform indic kpis recommend optim strategi stay updat social medium trend algorithm chang
DIGITAL-MEDIA,SEO Specialist,"Job Title: SEO Specialist. Description: Technical SEO Specialists optimize website infrastructure, addressing issues like site speed, mobile-friendliness, and structured data to enhance search engine visibility. Skills: Technical SEO audits Website crawl analysis Schema markup XML sitemaps Canonicalization Responsibilities: Identify and resolve technical SEO issues, such as crawl errors, website speed, and mobile-friendliness. Implement schema markup and structured data. Ensure website indexing and sitemap accuracy.",4,job titl seo specialist descript technic seo specialist optim websit infrastructur address issu like site speed mobil friendli structur data enhanc search engin visibl skill technic seo audit websit crawl analysi schema markup xml sitemap canonic respons identifi resolv technic seo issu crawl error websit speed mobil friendli implement schema markup structur data ensur websit index sitemap accuraci
DIGITAL-MEDIA,SEO Specialist,"Job Title: SEO Specialist. Description: Content SEO Strategists create SEO strategies specifically for content, focusing on keyword integration, content quality, and user engagement to boost organic traffic. Skills: Content strategy SEO content optimization Content marketing Keyword mapping Analytics Responsibilities: Develop content strategies for SEO, including keyword integration and content optimization. Collaborate with content creators to align content with SEO goals. Track content performance and make improvements.",5,job titl seo specialist descript content seo strategist creat seo strategi specif content focus keyword integr content qualiti user engag boost organ traffic skill content strategi seo content optim content market keyword map analyt respons develop content strategi seo includ keyword integr content optim collabor content creator align content seo goal track content perform make improv
DIGITAL-MEDIA,Social Media Manager,"Job Title: Social Media Manager. Description: Social Media Strategists develop and execute social media strategies to achieve marketing goals. They analyze social media trends, create content calendars, and measure the effectiveness of social media campaigns. Skills: Social media marketing strategy development Content planning and creation Social media advertising and targeting Data-driven decision-making Social media trends and platform updates Responsibilities: Develop and implement social media strategies to increase brand awareness and engagement. Create and curate content for various social media platforms. Monitor social media metrics and analyze performance.",6,job titl social medium manag descript social medium strategist develop execut social medium strategi achiev market goal analyz social medium trend creat content calendar measur effect social medium campaign skill social medium market strategi develop content plan creation social medium advertis target data driven decis make social medium trend platform updat respons develop implement social medium strategi increas brand awar engag creat curat content various social medium platform monitor social medium metric analyz perform
DIGITAL-MEDIA,Digital Marketing Specialist,"Job Title: Digital Marketing Specialist. Description: Email Marketing Specialists design and execute email marketing campaigns. They create email content, segment email lists, and analyze campaign performance to achieve marketing goals and engage subscribers. Skills: Email marketing platforms (e.g., Mailchimp, Constant Contact) Email campaign creation and segmentation A/B testing and optimization Email deliverability and compliance Metrics tracking and analysis Responsibilities: Plan and execute email marketing campaigns, including creating email content and designs. Segment email lists and analyze email performance metrics. A/B test email campaigns for optimization.",7,job titl digit market specialist descript email market specialist design execut email market campaign creat email content segment email list analyz campaign perform achiev market goal engag subscrib skill email market platform mailchimp constant contact email campaign creation segment test optim email deliver complianc metric track analysi respons plan execut email market campaign includ creat email content design segment email list analyz email perform metric test email campaign optim
DIGITAL-MEDIA,SEO Specialist,"Job Title: SEO Specialist. Description: SEO Analysts optimize websites for search engines, conduct keyword research, analyze performance metrics, and implement strategies to improve search rankings. Skills: Search engine optimization Keyword research SEO tools (e.g., Google Analytics, SEMrush) On-page and off-page optimization Responsibilities: Conduct keyword research, on-page and off-page SEO optimization, and website audits. Monitor search engine rankings and website traffic. Generate SEO reports and recommendations.",8,job titl seo specialist descript seo analyst optim websit search engin conduct keyword research analyz perform metric implement strategi improv search rank skill search engin optim keyword research seo tool googl analyt semrush page page optim respons conduct keyword research page page seo optim websit audit monitor search engin rank websit traffic generat seo report recommend
