Category,Job_Title,Job_Description,JD_Number,Cleaned_JD
DESIGNER,Graphic Designer,"Job Title: Graphic Designer. Description: Print Graphic Designers design graphics and layouts for printed materials such as brochures, posters, and packaging. They use their creativity and design skills to visually communicate messages and information effectively in printed form. Skills: Print design software (e.g., Adobe InDesign, Illustrator) Layout and composition Print production processes Color theory and management Attention to detail Print industry knowledge Responsibilities: Design printed materials such as brochures, posters, and packaging. Choose appropriate printing methods and materials. Collaborate with print vendors and ensure quality output.",5,job titl graphic design descript print graphic design design graphic layout print materi brochur poster packag use creativ design skill visual communic messag inform effect print form skill print design softwar adob indesign illustr layout composit print product process color theori manag attent detail print industri knowledg respons design print materi brochur poster packag choos appropri print method materi collabor print vendor ensur qualiti output
DESIGNER,Product Designer,"Job Title: Product Designer. Description: An Industrial Designer creates and improves product designs, focusing on aesthetics, functionality, and user experience to produce innovative and marketable products. Skills: Industrial design principles CAD and 3D modeling Prototyping and testing Responsibilities: Focus on the physical design and aesthetics of products. Develop product concepts, sketches, and 3D models. Collaborate with engineers for product feasibility.",6,job titl product design descript industri design creat improv product design focus aesthet function user experi produc innov market product skill industri design principl cad model prototyp test respons focus physic design aesthet product develop product concept sketch model collabor engin product feasibl
DESIGNER,Graphic Designer,"Job Title: Graphic Designer. Description: UI/UX Designers focus on creating user-friendly and visually appealing interfaces for digital products. They conduct user research, design wireframes and prototypes, and collaborate with development teams to ensure a seamless and enjoyable user experience. Skills: User interface (UI) design User experience (UX) design Wireframing and prototyping tools (e.g., Sketch, Figma) Usability testing Information architecture Interaction design Mobile and responsive design Responsibilities: Focus on user interface (UI) and user experience (UX) design for websites and applications to enhance user engagement. Conduct user research and usability testing. Collaborate with developers to implement designs.",7,job titl graphic design descript ui ux design focus creat user friend visual appeal interfac digit product conduct user research design wirefram prototyp collabor develop team ensur seamless enjoy user experi skill user interfac ui design user experi ux design wirefram prototyp tool sketch figma usabl test inform architectur interact design mobil respons design respons focus user interfac ui user experi ux design websit applic enhanc user engag conduct user research usabl test collabor develop implement design
DESIGNER,Web Designer,"Job Title: Web Designer. Description: E-commerce Web Designers specialize in designing and optimizing online stores and shopping websites. They focus on user experience, product presentation, and conversion rate optimization to drive online sales and customer engagement. Skills: E-commerce web design UX/UI design Shopping cart integration Payment gateway integration Mobile responsiveness E-commerce platforms (e.g., Shopify) Responsibilities: Focus on designing user interfaces for e-commerce websites, including product listings, shopping carts, and checkout processes. Enhance the online shopping experience and conversion rates.",8,job titl web design descript commerc web design special design optim onlin store shop websit focus user experi product present convers rate optim drive onlin sale custom engag skill commerc web design ux ui design shop cart integr payment gateway integr mobil respons commerc platform shopifi respons focus design user interfac commerc websit includ product list shop cart checkout process enhanc onlin shop experi convers rate
DESIGNER,Graphic Designer,"Job Title: Graphic Designer. Description: Web Graphic Designers create visually appealing graphics, images, and layouts for websites. They work closely with web developers and UI/UX designers to ensure that web content is aesthetically pleasing, on-brand, and engaging to users. Skills: Graphic design tools (e.g., Adobe Creative Suite) Web design principles User interface (UI) design Visual communication Typography Creativity and artistic skills Responsibilities: Create visually appealing graphics and layouts for websites, digital marketing materials, and user interfaces. Ensure consistent branding across digital platforms. Optimize images and graphics for web use.",9,job titl graphic design descript web graphic design creat visual appeal graphic imag layout websit work close web develop ui ux design ensur web content aesthet pleas brand engag user skill graphic design tool adob creativ suit web design principl user interfac ui design visual communic typographi creativ artist skill respons creat visual appeal graphic layout websit digit market materi user interfac ensur consist brand across digit platform optim imag graphic web use
SALES,Account Manager,"Job Title: Account Manager. Description: A Sales Account Manager is responsible for building and maintaining relationships with clients, identifying their needs, and proposing tailored solutions to achieve sales targets. Skills: Account management Sales strategy Negotiation and closing skills Responsibilities: Manage sales accounts and ensure revenue growth. Identify cross-selling and upselling opportunities. Develop account strategies and forecasts.",1,job titl account manag descript sale account manag respons build maintain relationship client identifi need propos tailor solut achiev sale target skill account manag sale strategi negoti close skill respons manag sale account ensur revenu growth identifi cross sell upsel opportun develop account strategi forecast
SALES,Sales Manager,"Job Title: Sales Manager. Description: Oversee sales operations within a specific region, develop sales plans, and manage regional sales teams. Skills: Sales strategy development Territory management Sales team leadership Responsibilities: Oversee sales activities and strategy for a specific geographic region. Develop sales plans and objectives. Analyze regional market trends and competition.",2,job titl sale manag descript overse sale oper within specif region develop sale plan manag region sale team skill sale strategi develop territori manag sale team leadership respons overse sale activ strategi specif geograph region develop sale plan object analyz region market trend competit
SALES,Sales Representative,"Job Title: Sales Representative. Description: Inside Sales Representatives are responsible for selling products or services to customers over the phone or through online channels. They engage with leads, answer customer inquiries, and use persuasive communication to close sales and meet revenue targets. Skills: Sales prospecting and lead generation Sales presentation and communication CRM software (e.g., Salesforce) Sales negotiation and closing techniques Product knowledge Relationship building Responsibilities: Identify and qualify sales leads, conduct sales presentations, and close deals through phone and email. Maintain accurate sales records and reports. Provide excellent customer service throughout the sales process.",3,job titl sale repres descript insid sale repres respons sell product servic custom phone onlin channel engag lead answer custom inquiri use persuas communic close sale meet revenu target skill sale prospect lead generat sale present communic crm softwar salesforc sale negoti close techniqu product knowledg relationship build respons identifi qualifi sale lead conduct sale present close deal phone email maintain accur sale record report provid excel custom servic throughout sale process
SALES,Sales Representative,"Job Title: Sales Representative. Description: Account Executives manage and grow relationships with existing clients or customers. They understand client needs, propose solutions, negotiate contracts, and ensure customer satisfaction, often working closely with sales and customer support teams. Skills: Sales strategy and planning Account management Customer relationship management Solution selling Sales forecasting Contract negotiation Sales metrics and reporting Responsibilities: Manage client accounts, negotiate contracts, and achieve revenue targets by selling products or services. Provide ongoing support and solutions to clients. Collaborate with cross-functional teams to meet client needs.",4,job titl sale repres descript account execut manag grow relationship exist client custom understand client need propos solut negoti contract ensur custom satisfact often work close sale custom support team skill sale strategi plan account manag custom relationship manag solut sell sale forecast contract negoti sale metric report respons manag client account negoti contract achiev revenu target sell product servic provid ongo support solut client collabor cross function team meet client need
SALES,Sales Manager,"Job Title: Sales Manager. Description: Lead and motivate sales teams, set sales targets, and develop sales strategies to meet goals. Skills: Sales leadership Team management Sales strategy and planning Responsibilities: Lead and manage a team of sales representatives. Set sales targets and goals. Provide coaching, training, and performance evaluations.",5,job titl sale manag descript lead motiv sale team set sale target develop sale strategi meet goal skill sale leadership team manag sale strategi plan respons lead manag team sale repres set sale target goal provid coach train perform evalu
SALES,Account Manager,"Job Title: Account Manager. Description: Build and maintain strong client relationships, understand their needs, and ensure client satisfaction. Skills: Client relationship management Customer service Communication skills Responsibilities: Build and nurture strong client relationships. Understand client needs and objectives. Serve as the main point of contact for client communication.",6,job titl account manag descript build maintain strong client relationship understand need ensur client satisfact skill client relationship manag custom servic communic skill respons build nurtur strong client relationship understand client need object serv main point contact client communic
SALES,Sales Manager,"Job Title: Sales Manager. Description: Manage key client accounts, build strong relationships, and drive revenue growth. Skills: Key account management Relationship building Sales negotiation Responsibilities: Build and maintain relationships with key clients. Develop account strategies and negotiate contracts. Ensure client satisfaction and retention.",7,job titl sale manag descript manag key client account build strong relationship drive revenu growth skill key account manag relationship build sale negoti respons build maintain relationship key client develop account strategi negoti contract ensur client satisfact retent
SALES,Sales Associate,"Job Title: Sales Associate. Description: A Retail Sales Associate assists customers in retail environments, helping them find products, providing product information, and ensuring a positive shopping experience. Skills: Customer service Sales techniques Product knowledge Cash handling Communication skills Responsibilities: Assist customers in retail stores, answer questions, and provide product information. Process sales transactions and handle customer inquiries and returns. Maintain store displays and merchandising.",8,job titl sale associ descript retail sale associ assist custom retail environ help find product provid product inform ensur posit shop experi skill custom servic sale techniqu product knowledg cash handl communic skill respons assist custom retail store answer question provid product inform process sale transact handl custom inquiri return maintain store display merchandis
SALES,Sales Representative,"Job Title: Sales Representative. Description: Outside Sales Representatives meet with potential customers in person to sell products or services. They build relationships, identify sales opportunities, and provide product information and solutions to meet the needs of clients and achieve sales goals. Skills: Sales prospecting and networking Face-to-face sales meetings Territory management Consultative selling Relationship building Sales tracking and reporting Responsibilities: Meet potential clients in person, attend industry events, and build and maintain relationships to drive sales. Conduct product demonstrations and presentations. Negotiate contracts and pricing.",9,job titl sale repres descript outsid sale repres meet potenti custom person sell product servic build relationship identifi sale opportun provid product inform solut meet need client achiev sale goal skill sale prospect network face face sale meet territori manag consult sell relationship build sale track report respons meet potenti client person attend industri event build maintain relationship drive sale conduct product demonstr present negoti contract price
FINANCE,Investment Analyst,"Job Title: Investment Analyst. Description: A Risk Analyst assesses and manages financial risks within an organization. They use data analysis and modeling to evaluate potential risks and recommend mitigation strategies. Skills: Risk assessment Data analysis Financial modeling Risk management tools Regulatory compliance knowledge Responsibilities: Evaluate investment risks, including market, credit, and operational risks. Develop risk models and stress tests. Implement risk management strategies and controls.",1,job titl invest analyst descript risk analyst assess manag financi risk within organ use data analysi model evalu potenti risk recommend mitig strategi skill risk assess data analysi financi model risk manag tool regulatori complianc knowledg respons evalu invest risk includ market credit oper risk develop risk model stress test implement risk manag strategi control
FINANCE,Investment Analyst,"Job Title: Investment Analyst. Description: A Portfolio Manager oversees investment portfolios, making decisions to maximize returns and minimize risks. They analyze financial markets and adjust asset allocations accordingly. Skills: Investment management Financial analysis Risk assessment Asset allocation Portfolio optimization Responsibilities: Manage investment portfolios, making investment decisions and asset allocation. Conduct research and analysis to identify investment opportunities. Monitor portfolio performance and risk.",2,job titl invest analyst descript portfolio manag overse invest portfolio make decis maxim return minim risk analyz financi market adjust asset alloc accord skill invest manag financi analysi risk assess asset alloc portfolio optim respons manag invest portfolio make invest decis asset alloc conduct research analysi identifi invest opportun monitor portfolio perform risk
FINANCE,Financial Analyst,"Job Title: Financial Analyst. Description: Investment Analysts analyze financial data and market trends to make informed investment recommendations. They research and assess investment opportunities, create financial models, and provide insights to guide investment decisions and portfolio management. Skills: Financial analysis Investment evaluation Portfolio management Data analysis Responsibilities: Analyze financial data, research investment opportunities, and provide recommendations for investment decisions. Monitor financial markets and economic trends. Prepare investment reports and presentations.",3,job titl financi analyst descript invest analyst analyz financi data market trend make inform invest recommend research assess invest opportun creat financi model provid insight guid invest decis portfolio manag skill financi analysi invest evalu portfolio manag data analysi respons analyz financi data research invest opportun provid recommend invest decis monitor financi market econom trend prepar invest report present
FINANCE,Financial Controller,"Job Title: Financial Controller. Description: Finance Managers oversee an organizations financial operations, including budgeting, financial reporting, and investment management. They analyze financial data, make strategic financial decisions, and ensure compliance with financial regulations. Skills: Financial management Budgeting Financial analysis Financial reporting Risk management Financial software (e.g., Excel, QuickBooks) Strategic planning Responsibilities: Oversee financial operations, including budgeting, financial reporting, and cash flow management. Ensure compliance with accounting standards and regulations. Supervise finance staff.",4,job titl financi control descript financ manag overse organ financi oper includ budget financi report invest manag analyz financi data make strateg financi decis ensur complianc financi regul skill financi manag budget financi analysi financi report risk manag financi softwar excel quickbook strateg plan respons overse financi oper includ budget financi report cash flow manag ensur complianc account standard regul supervis financ staff
FINANCE,Financial Analyst,"Job Title: Financial Analyst. Description: Financial Planners help clients achieve their financial goals by providing personalized financial advice and investment strategies. They assess clients financial situations, develop financial plans, and offer recommendations on savings, investments, and retirement planning. Skills: Financial planning Investment strategy Retirement planning Tax knowledge Responsibilities: Assist clients with financial planning, investment strategies, and retirement planning. Conduct comprehensive financial assessments. Provide personalized financial advice and recommendations.",5,job titl financi analyst descript financi planner help client achiev financi goal provid person financi advic invest strategi assess client financi situat develop financi plan offer recommend save invest retir plan skill financi plan invest strategi retir plan tax knowledg respons assist client financi plan invest strategi retir plan conduct comprehens financi assess provid person financi advic recommend
FINANCE,Financial Advisor,"Job Title: Financial Advisor. Description: Wealth Management Advisors provide comprehensive financial planning and investment management services to high-net-worth individuals and families. Skills: Wealth management strategies Asset allocation Estate planning Tax management Client relationship management Responsibilities: Manage high-net-worth clients financial portfolios and assets. Offer comprehensive wealth management services, including estate planning and asset allocation. Provide personalized financial guidance.",6,job titl financi advisor descript wealth manag advisor provid comprehens financi plan invest manag servic high net worth individu famili skill wealth manag strategi asset alloc estat plan tax manag client relationship manag respons manag high net worth client financi portfolio asset offer comprehens wealth manag servic includ estat plan asset alloc provid person financi guidanc
FINANCE,Financial Controller,"Job Title: Financial Controller. Description: Accounting Controllers manage an organizations accounting and financial reporting functions. They ensure accurate financial records, compliance with accounting standards, and timely financial reporting to support informed decision-making. Skills: Accounting Financial reporting Financial audits Tax compliance Accounting software (e.g., SAP, Oracle) GAAP (Generally Accepted Accounting Principles) Responsibilities: Manage accounting functions, including accounts payable and receivable, payroll, and financial statement preparation. Conduct financial analysis and forecasting. Coordinate audits and tax filings.",7,job titl financi control descript account control manag organ account financi report function ensur accur financi record complianc account standard time financi report support inform decis make skill account financi report financi audit tax complianc account softwar sap oracl gaap general accept account principl respons manag account function includ account payabl receiv payrol financi statement prepar conduct financi analysi forecast coordin audit tax file
FINANCE,Finance Manager,"Job Title: Finance Manager. Description: Accounting Managers supervise accounting teams. They ensure accurate financial reporting, manage budgets, and oversee financial transactions and compliance with accounting standards. Skills: Accounting principles Financial reporting Team management Budgeting Financial analysis Responsibilities: Manage accounting functions, including financial reporting and compliance. Ensure accurate and timely financial statements. Oversee audits and tax filings.",8,job titl financ manag descript account manag supervis account team ensur accur financi report manag budget overse financi transact complianc account standard skill account principl financi report team manag budget financi analysi respons manag account function includ financi report complianc ensur accur time financi statement overse audit tax file
FINANCE,Financial Advisor,"Job Title: Financial Advisor. Description: Investment Advisors offer financial advice to clients, helping them make investment decisions, manage portfolios, and achieve their financial goals. Skills: Investment strategies Portfolio management Financial planning Risk assessment Regulatory compliance Responsibilities: Provide investment advice and portfolio management services. Assess clients financial goals and risk tolerance. Monitor market trends and recommend investment strategies.",9,job titl financi advisor descript invest advisor offer financi advic client help make invest decis manag portfolio achiev financi goal skill invest strategi portfolio manag financi plan risk assess regulatori complianc respons provid invest advic portfolio manag servic assess client financi goal risk toler monitor market trend recommend invest strategi
FINANCE,Financial Analyst,"Job Title: Financial Analyst. Description: Budget Analysts manage and analyze financial data to develop, monitor, and report on budgets. They work with departments to ensure budget compliance, identify cost-saving opportunities, and provide financial insights to support strategic planning and decision-making. Skills: Budget planning Financial forecasting Excel proficiency Data analysis Responsibilities: Develop and manage budgets, track financial performance, and prepare financial reports. Collaborate with department heads to create and monitor budget plans. Identify cost-saving opportunities.",10,job titl financi analyst descript budget analyst manag analyz financi data develop monitor report budget work depart ensur budget complianc identifi cost save opportun provid financi insight support strateg plan decis make skill budget plan financi forecast excel profici data analysi respons develop manag budget track financi perform prepar financi report collabor depart head creat monitor budget plan identifi cost save opportun
BANKING,Investment Banker,"Job Title: Investment Banker. Description: A Financial Analyst conducts financial analysis, generates reports, and provides insights to support decision-making, budgeting, and financial planning. Skills: Financial analysis Data analysis Financial modeling Responsibilities: Analyze financial data, research investment opportunities, and provide recommendations for investment decisions. Create financial models and projections. Collaborate with clients on investment strategies.",1,job titl invest banker descript financi analyst conduct financi analysi generat report provid insight support decis make budget financi plan skill financi analysi data analysi financi model respons analyz financi data research invest opportun provid recommend invest decis creat financi model project collabor client invest strategi
BANKING,Investment Banker,"Job Title: Investment Banker. Description: An Investment Portfolio Manager manages investment portfolios, making investment decisions, monitoring performance, and optimizing asset allocation for clients or the organization. Skills: Investment analysis Portfolio management Risk assessment Responsibilities: Manage investment portfolios on behalf of clients or organizations. Monitor portfolio performance and adjust investment strategies. Provide regular reports and updates to clients.",2,job titl invest banker descript invest portfolio manag manag invest portfolio make invest decis monitor perform optim asset alloc client organ skill invest analysi portfolio manag risk assess respons manag invest portfolio behalf client organ monitor portfolio perform adjust invest strategi provid regular report updat client
