Category,Job_Title,Job_Description,JD_Number
HR,Human Resources Manager,"Job Title: Human Resources Manager. Description: Talent Acquisition Managers oversee the recruitment and hiring process. They develop recruitment strategies, source candidates, conduct interviews, and collaborate with hiring managers to attract and hire qualified talent to meet the organizations staffing needs. Skills: Talent sourcing Interviewing Onboarding Recruitment strategies HR software Responsibilities: Lead talent acquisition efforts, including sourcing, interviewing, and onboarding new employees. Collaborate with hiring managers to define job requirements. Develop and implement recruitment strategies.",1
HR,HR Coordinator,"Job Title: HR Coordinator. Description: Training Coordinators design and implement employee training programs. They assess training needs, develop training materials, and facilitate training sessions to enhance employees skills and knowledge. Skills: Training program coordination Training material development Learning management systems Responsibilities: Coordinate employee training programs, track training records, and assist with training logistics. Identify training needs and develop training materials. Facilitate training sessions or workshops.",2
HR,HR Coordinator,"Job Title: HR Coordinator. Description: Recruitment Coordinators support the hiring process by scheduling interviews, screening candidates, and assisting with onboarding. They ensure a smooth recruitment process and maintain candidate records. Skills: Recruitment process Candidate screening Applicant tracking systems Communication Responsibilities: Assist with recruitment activities, including posting job openings, coordinating interviews, and managing applicant data. Ensure a positive candidate experience. Maintain recruitment records and metrics.",3
HR,HR Coordinator,"Job Title: HR Coordinator. Description: Benefits Coordinators administer employee benefit programs, including health insurance, retirement plans, and other perks. They assist employees with benefit inquiries and ensure compliance with benefit policies. Skills: Employee benefits administration Benefits compliance HRIS Benefits communication Responsibilities: Administer employee benefits programs, respond to benefits inquiries, and process benefit changes. Collaborate with benefits providers and brokers. Educate employees on available benefits.",4
HR,HR Manager,"Job Title: HR Manager. Description: A Human Resources Director leads HR functions, including talent acquisition, employee development, and HR strategy, to promote a positive work environment and support organizational goals. Skills: Strategic HR planning Employee relations Talent management HR policy development Leadership skills Responsibilities: Oversee all HR functions, including recruitment, benefits administration, employee relations, and policy development. Align HR strategies with business goals. Provide leadership to the HR team.",5
HR,Human Resources Manager,"Job Title: Human Resources Manager. Description: Employee Relations Specialists focus on maintaining positive relationships between employees and the organization. They address workplace issues, conduct investigations, mediate conflicts, and promote a healthy and productive work environment. Skills: Employee conflict resolution HR compliance Employee engagement Communication skills Responsibilities: Address employee concerns, resolve conflicts, and implement HR policies and programs to foster a positive work environment. Conduct investigations and recommend corrective actions. Promote employee engagement and satisfaction.",6
HR,HR Manager,"Job Title: HR Manager. Description: An HR Compliance Specialist ensures adherence to employment laws and regulations, conducts audits, and provides guidance to maintain legal compliance within the organization. Skills: Employment law knowledge Compliance management Auditing skills Employee relations Communication skills Responsibilities: Ensure HR policies and practices comply with legal and regulatory requirements. Conduct audits and investigations. Provide guidance on compliance issues.",7
HR,Human Resources Manager,"Job Title: Human Resources Manager. Description: HR Generalists handle various HR functions, including recruitment, employee relations, benefits administration, and HR compliance. They serve as a resource for employees and management, ensuring HR policies and practices align with organizational goals and legal requirements. Skills: HR policies and procedures Employee relations Recruitment Communication skills Responsibilities: Oversee various HR functions, including recruitment, benefits administration, and employee relations. Develop and implement HR policies and procedures. Handle employee inquiries and concerns.",8
HR,HR Manager,"Job Title: HR Manager. Description: An Employee Development Manager focuses on employee growth and skill development, designing and implementing training programs to enhance employee capabilities and performance. Skills: Training and development Performance management Learning programs Employee engagement Coaching and mentoring Responsibilities: Focus on employee training, development, and career advancement. Create training programs and succession plans. Foster a culture of continuous learning.",9
INFORMATION-TECHNOLOGY,Network Engineer,"Job Title: Network Engineer. Description: Wireless Network Engineers design, implement, and maintain wireless network solutions. They optimize wireless connectivity, troubleshoot issues, and ensure reliable and secure wireless communications. Skills: Wireless network design and architecture Wi-Fi standards and protocols RF (Radio Frequency) planning and optimization Wireless security protocols Troubleshooting wireless network issues Responsibilities: Design, configure, and optimize wireless networks, ensuring reliable and secure wireless connectivity. Troubleshoot wireless network issues. Plan and implement wireless network upgrades.",1
INFORMATION-TECHNOLOGY,Network Administrator,"Job Title: Network Administrator. Description: Protect an organizations computer networks and systems from security threats, monitor network traffic, and respond to incidents. Skills: Network security protocols Intrusion detection and prevention Security incident response Firewall administration Vulnerability assessment Security policies and procedures Log analysis Ethical hacking Problem-solving Communication skills Attention to detail Responsibilities: Manage and secure computer networks, including firewalls and intrusion detection systems. Monitor network traffic for security threats. Implement security policies and procedures.",2
INFORMATION-TECHNOLOGY,Software Engineer,"Job Title: Software Engineer. Description: A Backend Developer is tasked with building and maintaining the server-side logic and database infrastructure of web applications. They work on the core functionality, data storage, and server communication to ensure the application runs smoothly and efficiently. Skills: Proficiency in one or more backend programming languages (e.g., Java, Python, Node.js, Ruby) API development Database management (SQL or NoSQL) Server management and deployment Security best practices Knowledge of web frameworks (e.g., Express, Django) Responsibilities: Develop server-side logic and databases using programming languages like Java, Python, or Node.js. Ensure data security and integrity. Implement APIs for seamless communication between frontend and backend.",3
INFORMATION-TECHNOLOGY,Systems Administrator,"Job Title: Systems Administrator. Description: IT Support Specialists provide technical assistance to end-users, troubleshooting hardware and software problems, setting up equipment, and maintaining IT infrastructure. Skills: Technical troubleshooting Hardware and software support Customer service Problem-solving Communication Responsibilities: Provide technical support to end-users, troubleshoot hardware and software issues, and resolve IT-related problems. Install and configure computer systems and software. Maintain IT documentation and knowledge base.",4
INFORMATION-TECHNOLOGY,IT Support Specialist,"Job Title: IT Support Specialist. Description: Desktop Support Technicians troubleshoot and maintain desktop computer systems, resolving hardware and software problems for users. Skills: Desktop hardware and software troubleshooting Operating system expertise (e.g., Windows, macOS) Remote desktop support Hardware and software upgrades Customer service skills Responsibilities: Install, configure, and maintain desktop computers and peripherals. Perform hardware and software upgrades and repairs. Manage IT inventory and asset tracking.",5
INFORMATION-TECHNOLOGY,Software Developer,"Job Title: Software Developer. Description: Mobile App Developers design and develop mobile applications for various platforms. They collaborate with cross-functional teams to create user-friendly and functional mobile apps that meet user needs. Skills: Mobile app development languages (e.g., Java, Swift, Kotlin) Cross-platform development (e.g., React Native, Flutter) Mobile app design principles APIs and web services integration Debugging and troubleshooting Responsibilities: Create mobile applications for iOS and Android platforms. Optimize mobile app performance and user experience. Collaborate with cross-functional teams to define app requirements.",6
INFORMATION-TECHNOLOGY,Systems Engineer,"Job Title: Systems Engineer. Description: The role of a Systems Integration Specialist involves integrating various software and hardware components to create cohesive systems. You will design and implement solutions that enable different systems to communicate and work together seamlessly. Your responsibilities also include troubleshooting integration issues, ensuring data consistency, and collaborating with cross-functional teams. Skills: Systems integration Integration architecture Data mapping Middleware technologies API integration System testing Troubleshooting Responsibilities: Integrate various software and hardware systems within an organization, ensuring seamless data flow and interoperability. Collaborate with software developers and IT teams on integration projects.",7
INFORMATION-TECHNOLOGY,Network Engineer,"Job Title: Network Engineer. Description: Network Security Engineers focus on protecting network systems from cyber threats. They implement security measures, monitor network traffic, and respond to security incidents to safeguard the organizations data. Skills: Network security protocols and technologies Firewalls and intrusion detection systems Vulnerability assessment and penetration testing Security policy development and enforcement Incident response and recovery Responsibilities: Focus on network security, implement security measures, and protect against cyber threats. Conduct security audits and vulnerability assessments. Respond to security incidents and breaches.",8
INFORMATION-TECHNOLOGY,Network Administrator,"Job Title: Network Administrator. Description: Manage and maintain an organizations IT infrastructure, including servers, hardware, and software systems. Skills: System administration Server maintenance Active Directory Backup and recovery Cloud computing (e.g., AWS, Azure) Troubleshooting IT security best practices Collaboration Problem-solving Attention to detail Communication skills Technical knowledge Responsibilities: Administer servers and systems, ensuring uptime and reliability. Perform software installations and updates. Provide technical support to end-users.",9
INFORMATION-TECHNOLOGY,IT Manager,"Job Title: IT Manager. Description: An Infrastructure Manager is responsible for the operation and maintenance of an organizations IT infrastructure, including servers, networks, and data centers. Skills: Network administration System administration Virtualization technologies (e.g., VMware, Hyper-V) Storage management IT security Disaster recovery planning Capacity planning Monitoring and troubleshooting Cloud infrastructure (e.g., AWS, Azure) Vendor management Responsibilities: Manage IT infrastructure, including servers, networks, and data centers. Ensure high availability, security, and scalability of IT systems. Plan and implement technology upgrades.",10
DESIGNER,UX/UI Designer,"Job Title: UX/UI Designer. Description: User Interface Designers focus on the visual and interactive aspects of digital interfaces. They design layouts, buttons, and other elements to ensure a cohesive and visually appealing user interface. Skills: UI design principles and best practices Graphic design tools (e.g., Adobe Photoshop, Illustrator) Typography and color theory Visual design and layout Responsive design Responsibilities: Create visually appealing user interfaces (UI) that align with brand aesthetics and enhance user engagement. Design interface elements and interactive components. Ensure UI consistency across digital platforms.",1
DESIGNER,UX/UI Designer,"Job Title: UX/UI Designer. Description: Interaction Designers specialize in designing user interactions within digital interfaces. They create meaningful and engaging user experiences by considering user behaviors and system responses. Skills: Interaction design principles User behavior and psychology Wireframing and prototyping tools Animation and micro-interaction design Collaborative design processes Responsibilities: Work on interaction design, defining how users interact with digital products and ensuring a seamless user journey. Create wireframes and prototypes to illustrate interactions. Collaborate with developers to implement interaction designs.",2
DESIGNER,Web Designer,"Job Title: Web Designer. Description: Frontend Web Designers create the visual elements and user interfaces of websites. They use HTML, CSS, and JavaScript to design responsive, user-friendly web pages, ensuring a seamless and visually appealing online experience. Skills: Frontend web development HTML/CSS Responsive design User interface (UI) design Adobe Creative Suite Collaboration skills Responsibilities: Create visually appealing and responsive web designs using HTML, CSS, and JavaScript. Ensure cross-browser compatibility. Optimize web performance and page load times.",3
DESIGNER,UX/UI Designer,"Job Title: UX/UI Designer. Description: User Experience Designers create intuitive and user-friendly digital interfaces. They conduct user research, design prototypes, and work to enhance the overall user experience of websites and applications. Skills: User-centered design principles UX/UI design tools (e.g., Sketch, Adobe XD) Wireframing and prototyping Usability testing and user research Information architecture and user flows Responsibilities: Design and improve user experiences (UX) by creating intuitive and user-friendly interfaces for websites and applications. Conduct user research and usability testing. Collaborate with stakeholders to gather and incorporate feedback.",4
DESIGNER,Graphic Designer,"Job Title: Graphic Designer. Description: Print Graphic Designers design graphics and layouts for printed materials such as brochures, posters, and packaging. They use their creativity and design skills to visually communicate messages and information effectively in printed form. Skills: Print design software (e.g., Adobe InDesign, Illustrator) Layout and composition Print production processes Color theory and management Attention to detail Print industry knowledge Responsibilities: Design printed materials such as brochures, posters, and packaging. Choose appropriate printing methods and materials. Collaborate with print vendors and ensure quality output.",5
DESIGNER,Product Designer,"Job Title: Product Designer. Description: An Industrial Designer creates and improves product designs, focusing on aesthetics, functionality, and user experience to produce innovative and marketable products. Skills: Industrial design principles CAD and 3D modeling Prototyping and testing Responsibilities: Focus on the physical design and aesthetics of products. Develop product concepts, sketches, and 3D models. Collaborate with engineers for product feasibility.",6
DESIGNER,Graphic Designer,"Job Title: Graphic Designer. Description: UI/UX Designers focus on creating user-friendly and visually appealing interfaces for digital products. They conduct user research, design wireframes and prototypes, and collaborate with development teams to ensure a seamless and enjoyable user experience. Skills: User interface (UI) design User experience (UX) design Wireframing and prototyping tools (e.g., Sketch, Figma) Usability testing Information architecture Interaction design Mobile and responsive design Responsibilities: Focus on user interface (UI) and user experience (UX) design for websites and applications to enhance user engagement. Conduct user research and usability testing. Collaborate with developers to implement designs.",7
DESIGNER,Web Designer,"Job Title: Web Designer. Description: E-commerce Web Designers specialize in designing and optimizing online stores and shopping websites. They focus on user experience, product presentation, and conversion rate optimization to drive online sales and customer engagement. Skills: E-commerce web design UX/UI design Shopping cart integration Payment gateway integration Mobile responsiveness E-commerce platforms (e.g., Shopify) Responsibilities: Focus on designing user interfaces for e-commerce websites, including product listings, shopping carts, and checkout processes. Enhance the online shopping experience and conversion rates.",8
DESIGNER,Graphic Designer,"Job Title: Graphic Designer. Description: Web Graphic Designers create visually appealing graphics, images, and layouts for websites. They work closely with web developers and UI/UX designers to ensure that web content is aesthetically pleasing, on-brand, and engaging to users. Skills: Graphic design tools (e.g., Adobe Creative Suite) Web design principles User interface (UI) design Visual communication Typography Creativity and artistic skills Responsibilities: Create visually appealing graphics and layouts for websites, digital marketing materials, and user interfaces. Ensure consistent branding across digital platforms. Optimize images and graphics for web use.",9
SALES,Account Manager,"Job Title: Account Manager. Description: A Sales Account Manager is responsible for building and maintaining relationships with clients, identifying their needs, and proposing tailored solutions to achieve sales targets. Skills: Account management Sales strategy Negotiation and closing skills Responsibilities: Manage sales accounts and ensure revenue growth. Identify cross-selling and upselling opportunities. Develop account strategies and forecasts.",1
SALES,Sales Manager,"Job Title: Sales Manager. Description: Oversee sales operations within a specific region, develop sales plans, and manage regional sales teams. Skills: Sales strategy development Territory management Sales team leadership Responsibilities: Oversee sales activities and strategy for a specific geographic region. Develop sales plans and objectives. Analyze regional market trends and competition.",2
SALES,Sales Representative,"Job Title: Sales Representative. Description: Inside Sales Representatives are responsible for selling products or services to customers over the phone or through online channels. They engage with leads, answer customer inquiries, and use persuasive communication to close sales and meet revenue targets. Skills: Sales prospecting and lead generation Sales presentation and communication CRM software (e.g., Salesforce) Sales negotiation and closing techniques Product knowledge Relationship building Responsibilities: Identify and qualify sales leads, conduct sales presentations, and close deals through phone and email. Maintain accurate sales records and reports. Provide excellent customer service throughout the sales process.",3
SALES,Sales Representative,"Job Title: Sales Representative. Description: Account Executives manage and grow relationships with existing clients or customers. They understand client needs, propose solutions, negotiate contracts, and ensure customer satisfaction, often working closely with sales and customer support teams. Skills: Sales strategy and planning Account management Customer relationship management Solution selling Sales forecasting Contract negotiation Sales metrics and reporting Responsibilities: Manage client accounts, negotiate contracts, and achieve revenue targets by selling products or services. Provide ongoing support and solutions to clients. Collaborate with cross-functional teams to meet client needs.",4
SALES,Sales Manager,"Job Title: Sales Manager. Description: Lead and motivate sales teams, set sales targets, and develop sales strategies to meet goals. Skills: Sales leadership Team management Sales strategy and planning Responsibilities: Lead and manage a team of sales representatives. Set sales targets and goals. Provide coaching, training, and performance evaluations.",5
SALES,Account Manager,"Job Title: Account Manager. Description: Build and maintain strong client relationships, understand their needs, and ensure client satisfaction. Skills: Client relationship management Customer service Communication skills Responsibilities: Build and nurture strong client relationships. Understand client needs and objectives. Serve as the main point of contact for client communication.",6
SALES,Sales Manager,"Job Title: Sales Manager. Description: Manage key client accounts, build strong relationships, and drive revenue growth. Skills: Key account management Relationship building Sales negotiation Responsibilities: Build and maintain relationships with key clients. Develop account strategies and negotiate contracts. Ensure client satisfaction and retention.",7
SALES,Sales Associate,"Job Title: Sales Associate. Description: A Retail Sales Associate assists customers in retail environments, helping them find products, providing product information, and ensuring a positive shopping experience. Skills: Customer service Sales techniques Product knowledge Cash handling Communication skills Responsibilities: Assist customers in retail stores, answer questions, and provide product information. Process sales transactions and handle customer inquiries and returns. Maintain store displays and merchandising.",8
SALES,Sales Representative,"Job Title: Sales Representative. Description: Outside Sales Representatives meet with potential customers in person to sell products or services. They build relationships, identify sales opportunities, and provide product information and solutions to meet the needs of clients and achieve sales goals. Skills: Sales prospecting and networking Face-to-face sales meetings Territory management Consultative selling Relationship building Sales tracking and reporting Responsibilities: Meet potential clients in person, attend industry events, and build and maintain relationships to drive sales. Conduct product demonstrations and presentations. Negotiate contracts and pricing.",9
FINANCE,Investment Analyst,"Job Title: Investment Analyst. Description: A Risk Analyst assesses and manages financial risks within an organization. They use data analysis and modeling to evaluate potential risks and recommend mitigation strategies. Skills: Risk assessment Data analysis Financial modeling Risk management tools Regulatory compliance knowledge Responsibilities: Evaluate investment risks, including market, credit, and operational risks. Develop risk models and stress tests. Implement risk management strategies and controls.",1
FINANCE,Investment Analyst,"Job Title: Investment Analyst. Description: A Portfolio Manager oversees investment portfolios, making decisions to maximize returns and minimize risks. They analyze financial markets and adjust asset allocations accordingly. Skills: Investment management Financial analysis Risk assessment Asset allocation Portfolio optimization Responsibilities: Manage investment portfolios, making investment decisions and asset allocation. Conduct research and analysis to identify investment opportunities. Monitor portfolio performance and risk.",2
FINANCE,Financial Analyst,"Job Title: Financial Analyst. Description: Investment Analysts analyze financial data and market trends to make informed investment recommendations. They research and assess investment opportunities, create financial models, and provide insights to guide investment decisions and portfolio management. Skills: Financial analysis Investment evaluation Portfolio management Data analysis Responsibilities: Analyze financial data, research investment opportunities, and provide recommendations for investment decisions. Monitor financial markets and economic trends. Prepare investment reports and presentations.",3
FINANCE,Financial Controller,"Job Title: Financial Controller. Description: Finance Managers oversee an organizations financial operations, including budgeting, financial reporting, and investment management. They analyze financial data, make strategic financial decisions, and ensure compliance with financial regulations. Skills: Financial management Budgeting Financial analysis Financial reporting Risk management Financial software (e.g., Excel, QuickBooks) Strategic planning Responsibilities: Oversee financial operations, including budgeting, financial reporting, and cash flow management. Ensure compliance with accounting standards and regulations. Supervise finance staff.",4
