Category,Job_Title,Job_Description,JD_Number
CONSULTANT,Research Analyst,"Job Title: Research Analyst. Description: A Data Analyst Researcher conducts research and analysis using data to support academic or scientific inquiries. They contribute to research projects and publish findings. Skills: Data analysis techniques Research methodologies Data collection and interpretation Statistical analysis software (e.g., R, Python) Data visualization tools (e.g., Tableau, Power BI) Research report writing Critical thinking Problem-solving Communication skills Attention to detail Responsibilities: Focus on data analysis, data mining, and statistical analysis to extract insights from large datasets. Develop data models and visualizations. Collaborate with data scientists and analysts.",9
TEACHER,Teacher,"Job Title: Teacher. Description: A Classroom Teacher educates students in a specific subject or grade level. They create lesson plans, deliver instruction, assess student progress, and foster a positive learning environment. Skills: Teaching pedagogy Classroom management Curriculum development Student assessment Differentiated instruction Responsibilities: Plan and deliver engaging lessons, adapting teaching methods to student needs. Assess student progress and provide feedback. Create a positive and inclusive classroom environment.",1
TEACHER,Teacher,"Job Title: Teacher. Description: A Special Education Teacher works with students who have disabilities, tailoring instruction to meet their unique needs and ensuring they have access to a quality education. Skills: Special education strategies Individualized education plans (IEPs) Behavior management techniques Collaboration with support staff Special education laws and regulations knowledge Responsibilities: Provide tailored instruction and support to students with special needs. Develop and implement Individualized Education Plans (IEPs). Collaborate with parents, therapists, and support staff.",2
TEACHER,Teacher,Job Title: Teacher. Description: A Subject Matter Expert possesses deep knowledge in a specific field and provides expertise to solve complex problems or guide decision-making within that domain. Skills: Expertise in a specific subject area Knowledge of curriculum standards Instructional design Assessment development Educational technology proficiency Responsibilities: Specialize in a particular subject area and develop curriculum materials. Provide expertise and guidance to other educators. Stay updated on educational trends and research.,3
ADVOCATE,Legal Assistant,"Job Title: Legal Assistant. Description: Provide administrative support to legal professionals, manage schedules, draft documents, and handle correspondence. Skills: Legal administrative tasks Document management Calendar and docketing Transcription File organization Communication with clients and courts Knowledge of legal terminology Attention to detail Multitasking Computer skills (e.g., MS Office) Responsibilities: Provide administrative support to legal professionals, including scheduling appointments and managing calendars. Prepare legal correspondence and forms. Maintain legal databases and records.",1
ADVOCATE,Legal Counsel,"Job Title: Legal Counsel. Description: Corporate Attorneys provide legal counsel and representation to organizations. They handle legal matters, contracts, mergers, acquisitions, and ensure compliance with laws and regulations relevant to the business. Skills: Corporate law and regulations Contract drafting and negotiation Legal research and analysis Risk management Excellent communication and negotiation skills Responsibilities: Provide legal advice and guidance on corporate matters, contracts, and regulatory compliance. Draft and review legal documents and agreements. Represent the company in legal proceedings.",2
ADVOCATE,Legal Assistant,"Job Title: Legal Assistant. Description: Assist lawyers with legal research, document preparation, and case management in law firms or legal departments. Skills: Legal research Document drafting Case management E-filing Legal databases (e.g., LexisNexis) Client communication Deposition preparation Trial support Ethics and confidentiality Attention to detail Communication skills Legal software proficiency Responsibilities: Assist lawyers in legal research, document preparation, and case management. Draft legal documents and pleadings. Organize and maintain case files.",3
ADVOCATE,Paralegal,"Job Title: Paralegal. Description: Assist in real estate transactions, including title searches, closings, and contract preparation. Skills: Real estate transactions Title searches Closing processes Deed preparation Contract review Communication with real estate professionals Attention to detail Real estate terminology Technology proficiency Legal software proficiency Legal research skills Responsibilities: Specialize in real estate transactions, including title searches, closings, and document preparation. Research property records and zoning regulations. Coordinate real estate transactions.",4
ADVOCATE,Legal Advisor,"Job Title: Legal Advisor. Description: In the role of In-House Counsel, you will provide legal support to the organization across various areas, including contracts, employment law, and regulatory compliance. You will draft legal documents, handle litigation matters, and advise on legal risks affecting day-to-day operations. Your role is crucial in ensuring the company operates within the bounds of the law. Skills: In-house counsel Legal advisory Employment law Intellectual property Regulatory compliance Dispute resolution Contract review Client counseling Responsibilities: Serve as in-house legal counsel for organizations, managing legal issues and contracts internally. Provide legal training to staff and address legal questions and concerns.",5
ADVOCATE,Legal Counsel,"Job Title: Legal Counsel. Description: An Intellectual Property Lawyer specializes in protecting and managing intellectual property rights, including patents, trademarks, and copyrights. They provide legal advice, handle trademark registration, patent applications, and enforce IP rights. Skills: Intellectual property law Trademark and patent law Copyright law IP portfolio management Litigation and dispute resolution Responsibilities: Protect and manage intellectual property rights, trademarks, patents, and copyrights. Conduct IP due diligence and trademark searches. Handle IP disputes and enforcement.",6
ADVOCATE,Paralegal,"Job Title: Paralegal. Description: Provide legal support to corporate legal teams, assist with mergers and acquisitions, and manage corporate records. Skills: Corporate legal tasks Document drafting Compliance Corporate governance Contract management Due diligence Entity formation Communication with stakeholders Attention to detail Technology proficiency Legal software proficiency Legal research skills Responsibilities: Support corporate legal matters, including mergers and acquisitions, contract drafting, and compliance. Maintain corporate records and filings. Assist in due diligence processes.",7
ADVOCATE,Legal Advisor,"Job Title: Legal Advisor. Description: As a Corporate Counsel, you will focus on legal matters related to corporate governance, mergers and acquisitions, and corporate compliance. You will draft and review corporate documents, oversee compliance programs, and handle complex legal negotiations. Your role includes managing legal relationships with external partners and providing strategic legal guidance to the company. Skills: Corporate law Compliance Mergers and acquisitions Corporate governance Contract drafting Risk management Legal strategy Due diligence Responsibilities: Specialize in corporate law, advising companies on legal compliance, mergers and acquisitions, and corporate governance. Ensure legal risk mitigation and compliance with corporate regulations. Handle corporate transactions and contracts.",8
ADVOCATE,Legal Advisor,"Job Title: Legal Advisor. Description: As a Legal Counsel, your responsibilities include providing legal advice, drafting contracts, and ensuring compliance with laws and regulations. You will represent the company in legal matters, negotiate agreements, and mitigate legal risks. Your role involves staying informed about changes in the law and advising management on legal issues affecting the business. Skills: Legal counsel Legal advice Contract negotiation Legal research Litigation support Client representation Legal writing Regulatory compliance Responsibilities: Provide legal advice and counsel to individuals, businesses, or organizations on various legal matters. Draft legal documents, contracts, and agreements. Represent clients in negotiations and legal proceedings.",9
ADVOCATE,Legal Assistant,"Job Title: Legal Assistant. Description: Assist in the preparation of litigation cases, manage electronic discovery, and handle technical aspects of trial preparation. Skills: E-discovery tools and processes Document review and production Litigation support software (e.g., Relativity) Data analysis Case management Communication with legal teams Technical proficiency Attention to detail Problem-solving Legal research skills Responsibilities: Specialize in eDiscovery and managing electronic documents for litigation. Collect, review, and produce electronic evidence. Collaborate with legal teams on case strategies.",10
ARTS,Art Director,"Job Title: Art Director. Description: An Art Curator is responsible for managing and preserving a collection of artworks. They curate exhibitions, acquire new pieces, and educate the public about the art. Skills: Art history and knowledge Art curation and exhibition planning Collections management Art market trends Cultural awareness Responsibilities: Curate and manage art collections, exhibitions, and galleries. Research and select artworks for display. Collaborate with artists, collectors, and institutions.",1
ARTS,Art Director,"Job Title: Art Director. Description: Visual Designers create visual content, including graphics, illustrations, and layouts, to convey messages and enhance brand identity. Skills: Graphic design Typography User interface (UI) design Adobe Creative Suite proficiency Branding and visual identity creation Responsibilities: Create visual concepts and designs for various media, such as print, digital, and advertising campaigns. Use graphic design software and tools to produce high-quality visuals. Collaborate with art and design teams to execute projects.",2
ARTS,Art Director,"Job Title: Art Director. Description: Creative Directors lead creative teams in developing visual and conceptual designs for various media, ensuring brand consistency and artistic quality. Skills: Creative leadership Art direction Concept development Visual design Advertising and marketing expertise Responsibilities: Lead and oversee creative teams, including graphic designers and copywriters. Develop and maintain the artistic and creative direction of projects. Ensure brand consistency and visual identity in all creative materials.",3
BUSINESS-DEVELOPMENT,Business Development Manager,"Job Title: Business Development Manager. Description: A Strategic Partnerships Manager identifies and develops strategic partnerships and alliances that benefit the organization, fostering collaborations and driving mutual success. Skills: Partnership development Negotiation and collaboration Business development Responsibilities: Identify and establish strategic partnerships and alliances. Negotiate partnership agreements and terms. Collaborate with partners to achieve mutual business goals.",1
BUSINESS-DEVELOPMENT,Business Development Manager,"Job Title: Business Development Manager. Description: A Sales Manager leads and guides the sales team, sets sales targets, develops sales strategies, and monitors performance to achieve revenue and growth objectives. Skills: Sales management Sales strategy development Team leadership Responsibilities: Lead and manage a sales team, set sales goals, and develop sales strategies. Identify new business opportunities and target markets. Build and maintain client relationships.",2
BUSINESS-DEVELOPMENT,Business Development Manager,"Job Title: Business Development Manager. Description: A Market Expansion Manager strategizes and executes plans to expand the companys presence in new markets, identifying growth opportunities and optimizing market penetration. Skills: Market expansion strategies Market research Sales planning and execution Responsibilities: Develop and execute plans to expand market presence and reach new customers. Conduct market research and competitor analysis. Evaluate market trends and opportunities.",3
AGRICULTURE,Operations Manager,"Job Title: Operations Manager. Description: Quality Control Managers establish and enforce quality standards within an organization. They develop quality control processes, perform inspections, and implement corrective actions to maintain product or service quality. Skills: Quality control processes and methodologies Statistical process control (SPC) Root cause analysis and corrective action Quality management systems (e.g., ISO 9001) Compliance and regulatory knowledge Responsibilities: Establish and enforce quality control standards and procedures. Conduct quality audits and inspections. Collaborate with production teams to address quality issues and implement improvements.",1
AGRICULTURE,Procurement Manager,"Job Title: Procurement Manager. Description: Analyze procurement data, identify cost-saving opportunities, and support the procurement process. Skills: Procurement processes Vendor assessment Contract negotiation Purchase order management Spend analysis Market research Supplier relationship management Data analysis Problem-solving Attention to detail Communication skills Financial acumen Responsibilities: Analyze procurement data and trends to support decision-making. Conduct supplier evaluations and performance assessments. Assist in procurement planning and forecasting.",2
AGRICULTURE,Supply Chain Manager,Job Title: Supply Chain Manager. Description: A Demand Planner analyzes historical sales data to forecast future demand for products. They work to optimize inventory levels and ensure product availability while minimizing costs. Skills: Demand forecasting Inventory management Data analysis Sales and operations planning (S&OP) ERP software proficiency Responsibilities: Analyze demand patterns and market trends to forecast product demand. Collaborate with production and sales teams to optimize inventory levels. Implement demand planning and forecasting tools.,3
AGRICULTURE,Operations Manager,"Job Title: Operations Manager. Description: Operations Directors oversee the daily operations of an organization. They develop and implement operational strategies, manage teams, and work to optimize processes to achieve business goals and efficiency. Skills: Operations management Strategic planning and execution Budgeting and financial analysis Leadership and team management Process improvement and optimization Responsibilities: Oversee and manage daily operations to ensure efficiency and productivity. Develop and implement operational strategies and goals. Lead and mentor a team of operations staff.",4
AGRICULTURE,Operations Manager,"Job Title: Operations Manager. Description: Supply Chain Managers manage the end-to-end supply chain process, from procurement to distribution. They optimize logistics, reduce costs, and ensure the efficient flow of products or services to meet customer demand. Skills: Supply chain logistics and management Inventory control and procurement Supplier relationship management Data analysis and forecasting Risk assessment and mitigation Responsibilities: Manage the supply chain process, including procurement, inventory management, and logistics. Optimize supply chain operations for cost-effectiveness and timely delivery. Monitor supplier performance and relationships.",5
AGRICULTURE,Procurement Manager,"Job Title: Procurement Manager. Description: Develop and execute sourcing strategies to procure goods and services, negotiate contracts, and manage supplier relationships. Skills: Strategic sourcing strategies Supplier evaluation and selection Negotiation skills Vendor management Cost analysis Supply chain management Contract management Problem-solving Attention to detail Communication skills Strategic thinking Responsibilities: Develop sourcing strategies and manage supplier relationships. Negotiate contracts and terms. Optimize procurement processes and costs.",6
AGRICULTURE,Supply Chain Manager,"Job Title: Supply Chain Manager. Description: A Logistics Manager oversees the movement and storage of goods in a supply chain. They plan, implement, and manage the efficient transportation and distribution of products. Skills: Supply chain management Inventory control Transportation logistics Vendor relations Team leadership and management Responsibilities: Manage the transportation and distribution of goods. Optimize supply chain efficiency, reduce costs, and minimize delivery times. Monitor inventory levels and warehouse operations.",7
AGRICULTURE,Procurement Manager,"Job Title: Procurement Manager. Description: Promote diversity and inclusion in the supply chain, manage supplier diversity programs, and assess supplier performance. Skills: Supplier diversity programs Diversity and inclusion initiatives Supplier assessment and certification Data collection and reporting Vendor outreach and engagement Strategic planning Communication skills Relationship building Attention to diversity and inclusion principles Responsibilities: Promote supplier diversity initiatives and inclusion. Identify and onboard diverse suppliers. Monitor compliance with diversity goals and regulations.",8
APPAREL,Brand Manager,Job Title: Brand Manager. Description: A Product Brand Manager focuses on promoting and managing the brand identity of specific products or product lines within a companys portfolio. Skills: Product branding and marketing Product lifecycle management Cross-functional team collaboration Product launch planning Market segmentation and targeting Responsibilities: Manage the branding of specific products or product lines. Create product launch plans and marketing campaigns. Ensure consistent product messaging and brand representation.,1
APPAREL,Brand Manager,"Job Title: Brand Manager. Description: A Brand Strategist develops strategies to build and strengthen a companys brand identity. They research market trends and consumer preferences to guide branding decisions. Skills: Brand strategy development Market research and analysis Competitive analysis Brand positioning and messaging Creative direction and collaboration Responsibilities: Develop brand strategies, positioning, and messaging to drive brand awareness and loyalty. Conduct market research and competitor analysis. Collaborate with creative teams on branding materials.",2
APPAREL,Marketing Manager,"Job Title: Marketing Manager. Description: Brand Managers are responsible for maintaining and enhancing a brands image and reputation. They develop brand strategies, oversee branding campaigns, and ensure brand consistency in all marketing and communication efforts. Skills: Brand strategy development Brand identity and design Brand storytelling Marketing campaigns Brand performance measurement Creative thinking Strong communication skills Responsibilities: Manage the overall brand identity, create marketing campaigns, and ensure brand consistency across all materials and touchpoints. Monitor brand performance and reputation. Collaborate with creative teams on branding materials.",3
APPAREL,Marketing Manager,"Job Title: Marketing Manager. Description: Product Marketing Managers promote and market products or services. They create marketing strategies, conduct market research, develop messaging, and collaborate with cross-functional teams to launch and promote products effectively in the market. Skills: Product positioning and messaging Market research and analysis Product launch planning Competitive analysis Marketing collateral creation Pricing strategies Cross-functional collaboration Responsibilities: Promote specific products or services through marketing plans, product messaging, and collaboration with sales teams. Conduct market research and competitor analysis. Create product launch plans.",4
APPAREL,Brand Manager,"Job Title: Brand Manager. Description: A Brand Marketing Analyst analyzes market data and consumer behavior to assess the effectiveness of branding strategies. They provide insights to improve brand marketing efforts. Skills: Marketing analytics Data analysis tools (e.g., Google Analytics, Adobe Analytics) Brand performance measurement Consumer behavior analysis Campaign effectiveness evaluation Responsibilities: Analyze brand performance metrics and consumer behavior. Track marketing campaigns and assess their impact on brand perception. Provide insights and recommendations for brand improvement.",5
APPAREL,Marketing Manager,"Job Title: Marketing Manager. Description: Digital Marketing Managers lead digital marketing efforts, including SEO, SEM, social media, email marketing, and content strategy. They develop and execute digital marketing campaigns to increase brand awareness, drive traffic, and generate leads or sales. Skills: Digital marketing strategies SEO and SEM Social media marketing Email marketing campaigns Content marketing Web analytics (e.g., Google Analytics) Marketing automation tools (e.g., HubSpot, Marketo) Responsibilities: Develop and execute digital marketing strategies, including SEO, email marketing, and social media campaigns. Analyze digital marketing metrics and adjust strategies as needed. Manage digital marketing budgets.",6
APPAREL,Product Manager,"Job Title: Product Manager. Description: Agile Product Owners work closely with development teams in Agile environments. They define and prioritize product backlog items, communicate the product vision, and ensure that the product increments delivered align with customer needs and project objectives. Skills: Agile product development Scrum or Kanban frameworks Backlog management User story writing Prioritization techniques Collaboration with development teams Product vision and strategy Responsibilities: Act as the product owner in agile development, making critical decisions and ensuring product goals are met. Maintain and prioritize the product backlog. Communicate with stakeholders and development teams.",7
APPAREL,Product Manager,"Job Title: Product Manager. Description: Technical Product Managers oversee the development and enhancement of technical products. They define product requirements, prioritize features, collaborate with development teams, and ensure the product aligns with the companys strategic goals and market needs. Skills: Product management principles Technical background Agile development methodologies Product roadmap planning Market research and analysis Stakeholder communication Problem-solving skills Responsibilities: Define product requirements, prioritize features, and collaborate with development teams to deliver technical products. Create product roadmaps and release plans. Gather and incorporate feedback from stakeholders.",8
CONSTRUCTION,Project Manager,"Job Title: Project Manager. Description: The Agile Project Manager leads Agile teams, facilitating effective project development and delivery. They use Agile methodologies to manage tasks, prioritize work, and adapt to changing requirements while fostering collaboration among team members. Skills: Agile methodologies Scrum or Kanban Team collaboration Agile tools (e.g., Jira) Responsibilities: Facilitate agile project development, collaborate with cross-functional teams, and manage project backlogs and sprints. Coach and mentor team members on agile practices. Drive continuous improvement of agile processes.",1
CONSTRUCTION,Project Manager,"Job Title: Project Manager. Description: The Construction Project Manager oversees and manages construction projects, ensuring they are completed on time and within budget. They coordinate with contractors, architects, and other stakeholders to ensure successful project delivery. Skills: Construction management Budgeting Contract negotiation Safety regulations Responsibilities: Oversee construction projects, including budgeting, scheduling, and coordination of subcontractors. Ensure compliance with safety regulations. Communicate project status to stakeholders.",2
CONSTRUCTION,Project Manager,"Job Title: Project Manager. Description: IT Project Managers plan, execute, and oversee IT projects. They define project scope, allocate resources, manage budgets, and ensure projects are delivered on time and within scope. They also communicate project status and risks to stakeholders. Skills: Project management Team leadership Risk management Budgeting Communication skills Responsibilities: Plan and oversee IT projects, manage project teams, and ensure successful project delivery within scope, time, and budget. Define project objectives and requirements. Monitor project progress and risks.",3
PUBLIC-RELATIONS,Brand Manager,Job Title: Brand Manager. Description: A Product Brand Manager focuses on promoting and managing the brand identity of specific products or product lines within a companys portfolio. Skills: Product branding and marketing Product lifecycle management Cross-functional team collaboration Product launch planning Market segmentation and targeting Responsibilities: Manage the branding of specific products or product lines. Create product launch plans and marketing campaigns. Ensure consistent product messaging and brand representation.,1
